{
  "schemaVersion": "stacks-attacknet-phase-review-contract/v2",
  "reviewId": "release-1-amendment-a9-bitcoin-reorganizations",
  "phase": 2,
  "releaseScope": "Release 1 bounded Bitcoin reorganization amendment A9",
  "tier": "Full",
  "requiredReviewers": ["Codex", "Claude Opus 5"],
  "requirements": [
    "one-bounded-semantic-regtest-reorganization-api-with-no-arbitrary-rpc-surface",
    "prepare-approve-execute-recheck-protocol-proves-the-exact-higher-work-replacement-branch",
    "stale-approval-negative-control-mutates-no-bitcoin-branch",
    "policy-identity-boundary-and-overlap-safety-fail-closed-and-restore-exact-prior-cadence-state",
    "partial-failure-rpc-and-branch-evidence-remains-observable-before-cleanup",
    "trusted-stacks-miner-signer-and-follower-observations-classify-recovery",
    "replacement-flash-cadence-and-subsequent-policy-flash-are-bounded-and-evidence-bound",
    "same-seed-replay-on-a-fresh-network-reproduces-the-admitted-schedule-and-outcome-class",
    "clean-offline-race-envtest-helm-and-whole-product-verification",
    "kubelet-root-and-image-filesystem-capacity-is-proven-before-build-and-network-creation",
    "three-node-arm64-kind-qualification-and-complete-portable-forensic-evidence"
  ],
  "requiredInventory": [
    "candidate:contrib/helm/hacknet/operator/api/v1beta1/faultcampaign_types.go",
    "candidate:contrib/helm/hacknet/operator/api/v1beta1/burnchainpolicy_types.go",
    "candidate:contrib/helm/hacknet/operator/internal/burnchain/reorg.go",
    "candidate:contrib/helm/hacknet/operator/internal/burnchain/boundary.go",
    "candidate:contrib/helm/hacknet/operator/internal/burnchainworker/worker.go",
    "candidate:contrib/helm/hacknet/operator/internal/fault/reorg_mutation.go",
    "candidate:contrib/helm/hacknet/operator/internal/fault/v1beta1_compiler.go",
    "candidate:contrib/helm/hacknet/operator/internal/fault/v1beta1_validation.go",
    "candidate:contrib/helm/hacknet/operator/internal/fault/v1beta1_reconciler.go",
    "candidate:contrib/helm/hacknet/operator/internal/burnchainpolicy/runtime.go",
    "candidate:contrib/helm/hacknet/operator/internal/orchestratormetrics/collector.go",
    "candidate:contrib/attacknet/docs/concepts/bitcoin-reorganizations.md",
    "candidate:contrib/attacknet/examples/campaigns/bitcoin-two-block-reorg.yaml",
    "candidate:contrib/attacknet/release/amendments/a9/contract.json",
    "candidate:contrib/attacknet/release/amendments/a9/verify.mjs",
    "candidate:contrib/attacknet/release/amendments/a9/evidence.mjs",
    "candidate:contrib/attacknet/release/amendments/a9/packet.mjs",
    "candidate:contrib/attacknet/release/amendments/a9/a9.test.mjs",
    "candidate:contrib/attacknet/release/amendments/a9/qualification/live.mjs",
    "candidate:contrib/attacknet/evidence-packets/release-1-a9/README.md",
    "diff:candidate-bitcoin-reorganization",
    "evidence:verification",
    "test:attacknet-check",
    "test:hacknet-check",
    "evidence:storage-preflight",
    "evidence:live-qualification",
    "evidence:negative-control",
    "evidence:primary-run",
    "evidence:primary-campaign",
    "evidence:flash-receipt",
    "evidence:replay-run",
    "evidence:replay-campaign",
    "evidence:forensic-bundle",
    "evidence:archive-index",
    "evidence:archive",
    "evidence:summary",
    "attestation:signed-candidate"
  ]
}
