{
  "schemaVersion": "stacks-attacknet-phase-review-contract/v2",
  "reviewId": "release-1-amendment-a1-compose-retirement",
  "phase": 2,
  "releaseScope": "Release 1 Kubernetes-only runtime amendment A1",
  "tier": "Full",
  "requiredReviewers": [
    "Codex",
    "Claude Opus 5"
  ],
  "requirements": [
    "kubernetes-only-command-and-runtime-surface",
    "compose-implementation-and-artifact-retirement",
    "narrowed-release-baseline-without-dangling-claims",
    "truthful-operator-and-developer-documentation",
    "kubernetes-lifecycle-fault-evidence-and-clean-teardown",
    "portable-self-identifying-review-evidence",
    "clean-offline-verification"
  ],
  "requiredInventory": [
    "candidate:contrib/attacknet/README.md",
    "candidate:contrib/attacknet/OPERATIONS.md",
    "candidate:contrib/attacknet/DEVELOPMENT.md",
    "candidate:contrib/attacknet/REPRODUCIBILITY.md",
    "candidate:contrib/helm/hacknet/README.md",
    "candidate:contrib/attacknet/attacknet",
    "candidate:contrib/attacknet/command-contract.cjs",
    "candidate:contrib/attacknet/command-registry.v1.json",
    "candidate:contrib/attacknet/command-surface.test.mjs",
    "candidate:contrib/attacknet/runtime-backend.sh",
    "candidate:contrib/attacknet/runtime-backend.test.mjs",
    "candidate:contrib/attacknet/lifecycle.sh",
    "candidate:contrib/attacknet/burnchain-policy.sh",
    "candidate:contrib/attacknet/evidence-harness.sh",
    "candidate:contrib/attacknet/run-descriptor.mjs",
    "candidate:contrib/attacknet/run-ledger.mjs",
    "candidate:contrib/attacknet/run-ledger.test.mjs",
    "candidate:contrib/attacknet/topology.mjs",
    "candidate:contrib/attacknet/topology.test.mjs",
    "candidate:contrib/attacknet/release/baseline-v1.json",
    "candidate:contrib/attacknet/release/phase-0-contract.json",
    "candidate:contrib/attacknet/release/phase-zero-packet.mjs",
    "candidate:contrib/attacknet/release/phase-zero.test.mjs",
    "candidate:contrib/attacknet/release/PHASE-REVIEWS.md",
    "candidate:contrib/attacknet/release/phase-review.mjs",
    "candidate:contrib/attacknet/release/hacknet-offline-result.mjs",
    "candidate:contrib/attacknet/release/portable-live-evidence.mjs",
    "candidate:contrib/attacknet/release/review-contract-v1.schema.json",
    "candidate:contrib/attacknet/release/review-contract.schema.json",
    "candidate:contrib/attacknet/release/review-packet-v1.schema.json",
    "candidate:contrib/attacknet/release/review-packet.schema.json",
    "candidate:contrib/attacknet/release/release-1-a1-contract.json",
    "candidate:contrib/attacknet/release/release-1-a1-packet.mjs",
    "candidate:contrib/attacknet/release/release-1-a1.test.mjs",
    "candidate:contrib/attacknet/evidence-packets/release-1-a1/README.md",
    "candidate:contrib/helm/hacknet/scripts/check.sh",
    "diff:candidate-compose-retirement",
    "test:offline-check",
    "test:hacknet-check",
    "evidence:archive-index",
    "evidence:archive",
    "evidence:live-summary",
    "evidence:doctor",
    "evidence:lifecycle-apply",
    "evidence:verification",
    "evidence:fault-run",
    "evidence:evidence-capture",
    "evidence:clean-teardown"
  ]
}
