{
  "schemaVersion": "stacks-attacknet-phase-review-contract/v2",
  "reviewId": "release-1-amendment-a12-deterministic-adversarial-actors",
  "phase": 2,
  "releaseScope": "Release 1 deterministic adversarial actors amendment A12",
  "tier": "Full",
  "requiredReviewers": ["Codex", "Claude Opus 5"],
  "requirements": [
    "testing-only-signer-patch-is-source-bound-feature-gated-and-absent-from-normal-images",
    "typed-bounded-and-deterministic-policies-cover-withhold-delay-and-peer-response-suppression",
    "admitted-identity-binds-policy-image-network-policy-and-independent-observer-identities",
    "signer-behavior-campaigns-use-canonical-reward-set-weights-and-explicit-quorum-loss-opt-in",
    "signed-nonce-bound-observations-prove-before-during-after-policy-effects-with-bounded-status",
    "restricted-egress-allows-declared-data-plane-dependencies-while-denying-kubernetes-and-undeclared-endpoints",
    "policy-drift-normal-image-forgery-and-observer-replacement-controls-all-fail-closed-before-false-passage",
    "below-quorum-withholding-preserves-progress-while-deliberate-quorum-loss-cannot-be-reported-healthy",
    "fresh-network-replay-preserves-policy-match-count-classification-and-resolved-identity",
    "human-dashboards-and-forensic-bundles-distinguish-actor-action-protocol-impact-and-recovery",
    "clean-offline-race-envtest-helm-rbac-and-whole-product-verification",
    "three-node-arm64-kind-qualification-with-complete-archive-and-clean-final-teardown"
  ],
  "requiredInventory": [
    "candidate:contrib/helm/hacknet/operator/internal/adversarial/policy.go",
    "candidate:contrib/helm/hacknet/operator/internal/topology/networkpolicy.go",
    "candidate:contrib/helm/hacknet/operator/internal/fault/signer_behavior.go",
    "candidate:contrib/helm/hacknet/operator/internal/probeattribution/verify.go",
    "candidate:contrib/attacknet/test/fixtures/adversaries/deterministic-signer.patch",
    "candidate:contrib/attacknet/docs/concepts/adversarial-actors.md",
    "candidate:contrib/attacknet/docs/development/issues/r1/r1a12-deterministic-adversarial-actors.md",
    "candidate:contrib/attacknet/docs/reference/faults/signer-behavior.md",
    "candidate:contrib/attacknet/release/amendments/a12/contract.json",
    "candidate:contrib/attacknet/release/amendments/a12/verify.mjs",
    "candidate:contrib/attacknet/release/amendments/a12/evidence.mjs",
    "candidate:contrib/attacknet/release/amendments/a12/packet.mjs",
    "candidate:contrib/attacknet/release/amendments/a12/a12.test.mjs",
    "candidate:contrib/attacknet/release/amendments/a12/qualification/live.mjs",
    "candidate:contrib/attacknet/evidence-packets/release-1-a12/README.md",
    "diff:candidate-adversarial-actors",
    "evidence:verification",
    "test:attacknet-check",
    "test:hacknet-check",
    "evidence:candidate-build",
    "evidence:normal-image-control",
    "evidence:policy-drift-control",
    "evidence:egress-control",
    "evidence:forgery-control",
    "evidence:observer-replacement-control",
    "evidence:below-quorum-network",
    "evidence:below-quorum-run",
    "evidence:below-quorum-campaign",
    "evidence:quorum-loss-network",
    "evidence:quorum-loss-run",
    "evidence:quorum-loss-campaign",
    "evidence:replay-network",
    "evidence:replay-run",
    "evidence:replay-campaign",
    "evidence:forensic-bundle",
    "evidence:clean-teardown",
    "evidence:live-qualification",
    "evidence:archive-index",
    "evidence:archive",
    "evidence:summary",
    "attestation:signed-candidate"
  ]
}
