{
  "schemaVersion": "stacks-attacknet-phase-review-contract/v2",
  "reviewId": "release-1-amendment-a13-seeded-fuzzing-corpus-reduction",
  "phase": 2,
  "releaseScope": "Release 1 seeded fuzzing, corpus, and reduction amendment A13",
  "tier": "Full",
  "requiredReviewers": ["Codex", "Claude Opus 5"],
  "requirements": [
    "deterministic-finite-planning-records-versioned-decisions-materialization-and-advisory-inputs",
    "strict-template-configuration-and-capacity-admission-fail-before-cluster-mutation",
    "hash-chained-journals-local-and-cluster-single-writer-locks-resume-exact-resource-identities",
    "fresh-attempts-use-only-existing-typed-controllers-and-preserve-all-safety-budgets",
    "identity-bound-evidence-is-captured-before-suspension-and-incomplete-evidence-never-passes",
    "semantic-classification-fresh-confirmation-and-non-reproduction-exclude-apparatus-failures",
    "content-addressed-corpus-retains-advisories-and-verifies-replay-from-portable-artifacts",
    "removal-only-reduction-produces-a-smaller-confirmed-reproducer-without-causal-minimality-claims",
    "human-and-agent-interfaces-report-capacity-progress-classification-replay-and-reduction",
    "a11-version-cohorts-a12-behavior-templates-and-four-fault-families-compose-without-new-mutation-authority",
    "clean-offline-race-envtest-helm-rbac-and-whole-product-verification",
    "three-node-arm64-kind-qualification-with-complete-archive-and-clean-final-teardown"
  ],
  "requiredInventory": [
    "candidate:contrib/helm/hacknet/operator/internal/fuzzplan/planner.go",
    "candidate:contrib/helm/hacknet/operator/internal/fuzzsession/engine.go",
    "candidate:contrib/helm/hacknet/operator/internal/fuzzcorpus/store.go",
    "candidate:contrib/helm/hacknet/operator/internal/fuzzreduce/reducer.go",
    "candidate:contrib/helm/hacknet/operator/internal/attacknetcli/fuzz.go",
    "candidate:contrib/helm/hacknet/operator/internal/attacknetcli/fuzz_runtime.go",
    "candidate:contrib/attacknet/docs/operations/fuzzing.md",
    "candidate:contrib/attacknet/docs/development/issues/r1/r1a13-seeded-fuzzing-corpus-reduction.md",
    "candidate:contrib/attacknet/release/amendments/a13/contract.json",
    "candidate:contrib/attacknet/release/amendments/a13/verify.mjs",
    "candidate:contrib/attacknet/release/amendments/a13/evidence.mjs",
    "candidate:contrib/attacknet/release/amendments/a13/packet.mjs",
    "candidate:contrib/attacknet/release/amendments/a13/a13.test.mjs",
    "candidate:contrib/attacknet/release/amendments/a13/qualification/live.mjs",
    "candidate:contrib/attacknet/evidence-packets/release-1-a13/README.md",
    "diff:candidate-seeded-fuzzing",
    "evidence:verification",
    "test:attacknet-check",
    "test:hacknet-check",
    "evidence:planning-controls",
    "evidence:capacity-control",
    "evidence:advisory-controls",
    "evidence:resume-controls",
    "evidence:finite-session",
    "evidence:failure-confirmation",
    "evidence:non-reproduction",
    "evidence:evidence-loss-control",
    "evidence:reduction",
    "evidence:corpus-verification",
    "evidence:corpus-archive",
    "evidence:clean-teardown",
    "evidence:live-qualification",
    "evidence:archive-index",
    "evidence:archive",
    "evidence:summary",
    "attestation:signed-candidate"
  ]
}
