{
  "schemaVersion": "stacks-attacknet-phase-review-contract/v2",
  "reviewId": "release-1-amendment-a8-trusted-observations",
  "phase": 2,
  "releaseScope": "Release 1 trusted-observation and forensic-completeness amendment A8",
  "tier": "Full",
  "requiredReviewers": [
    "Codex",
    "Claude Opus 5"
  ],
  "requirements": [
    "qualification-is-bound-to-one-staged-tree-then-one-signed-roadmap-child-with-the-exact-tree-and-diff",
    "direct-actor-observations-are-uncached-inventory-bound-fresh-bounded-and-truthfully-classified",
    "finite-typed-baseline-active-fault-and-recovery-assertions-are-sealed-into-the-run-schedule",
    "violations-fail-and-missing-stale-ambiguous-or-missed-window-evidence-is-inconclusive-never-passed",
    "trusted-stacks-height-and-named-observations-drive-source-bound-trigger-receipts",
    "complete-paginated-loki-export-and-incident-capture-are-a-fail-closed-network-deletion-barrier",
    "protocol-assertion-and-source-health-are-visible-to-humans-and-machine-consumers",
    "clean-offline-race-envtest-helm-and-whole-product-verification",
    "three-node-kind-qualification-proves-clean-baseline-attributed-violation-source-loss-and-evidence-safe-teardown",
    "portable-self-identifying-review-evidence"
  ],
  "requiredInventory": [
    "candidate:contrib/helm/hacknet/operator/api/v1beta1/protocolassertion_types.go",
    "candidate:contrib/helm/hacknet/operator/internal/protocolobservation/reader.go",
    "candidate:contrib/helm/hacknet/operator/internal/protocolobservation/metric.go",
    "candidate:contrib/helm/hacknet/operator/internal/protocolobservation/derive.go",
    "candidate:contrib/helm/hacknet/operator/internal/protocolassertion/evaluator.go",
    "candidate:contrib/helm/hacknet/operator/internal/run/v1beta1_reconciler.go",
    "candidate:contrib/helm/hacknet/operator/internal/run/v1beta1_schedule.go",
    "candidate:contrib/helm/hacknet/operator/internal/fault/v1beta1_observations.go",
    "candidate:contrib/helm/hacknet/operator/internal/attacknetcli/loki_evidence.go",
    "candidate:contrib/helm/hacknet/operator/internal/attacknetcli/loki_kubernetes.go",
    "candidate:contrib/helm/hacknet/operator/internal/attacknetcli/backend.go",
    "candidate:contrib/helm/hacknet/operator/internal/attacknetcli/teardown.go",
    "candidate:contrib/helm/hacknet/operator/internal/orchestratormetrics/collector.go",
    "candidate:contrib/attacknet/observability/render.mjs",
    "candidate:contrib/attacknet/observability/dashboards/attacknet-overview.json",
    "candidate:contrib/attacknet/docs/concepts/run-scheduling.md",
    "candidate:contrib/attacknet/docs/operations/evidence.md",
    "candidate:contrib/attacknet/release/amendments/a8/contract.json",
    "candidate:contrib/attacknet/release/amendments/a8/qualified-source.mjs",
    "candidate:contrib/attacknet/release/amendments/a8/verify.mjs",
    "candidate:contrib/attacknet/release/amendments/a8/attest.mjs",
    "candidate:contrib/attacknet/release/amendments/a8/evidence.mjs",
    "candidate:contrib/attacknet/release/amendments/a8/packet.mjs",
    "candidate:contrib/attacknet/release/amendments/a8/a8.test.mjs",
    "candidate:contrib/attacknet/release/amendments/a8/qualification/candidate-build.mjs",
    "candidate:contrib/attacknet/release/amendments/a8/qualification/live.mjs",
    "candidate:contrib/attacknet/release/portable-live-evidence.mjs",
    "candidate:contrib/attacknet/release/offline-result.mjs",
    "candidate:contrib/attacknet/test/check.sh",
    "candidate:contrib/helm/hacknet/scripts/check.sh",
    "candidate:contrib/attacknet/evidence-packets/release-1-a8/README.md",
    "diff:candidate-trusted-observations",
    "evidence:verification",
    "test:attacknet-check",
    "test:hacknet-check",
    "evidence:live-qualification",
    "evidence:archive-index",
    "evidence:archive",
    "evidence:summary",
    "attestation:signed-candidate"
  ]
}
