{
  "schemaVersion": "stacks-attacknet-phase-review-contract/v2",
  "reviewId": "release-1-amendment-a11-mixed-version-upgrades",
  "phase": 2,
  "releaseScope": "Release 1 mixed-version and upgrade orchestration amendment A11",
  "tier": "Full",
  "requiredReviewers": ["Codex", "Claude Opus 5"],
  "requirements": [
    "arbitrary-remote-local-dirty-and-prebuilt-profiles-resolve-to-immutable-source-build-image-and-config-provenance",
    "explicit-and-seeded-assignments-are-finite-deterministic-and-replayable",
    "exact-profile-and-actor-configurations-fail-closed-and-remain-bound-through-admitted-runtime-identity",
    "static-released-majority-and-current-candidate-cohorts-are-observable-and-protocol-compatible",
    "topology-owned-upgrade-campaigns-preserve-single-writer-ownership-and-run-scheduler-integration",
    "upgrade-stages-enforce-budgets-boundaries-readiness-protocol-gates-and-exact-identity-transitions",
    "configuration-startup-protocol-telemetry-build-admission-and-harness-outcomes-remain-distinct",
    "failure-rolls-back-to-the-exact-admitted-baseline-and-replay-preserves-the-sealed-matrix-and-outcome-class",
    "bounded-cardinality-version-observability-and-complete-identity-bound-forensic-evidence",
    "clean-offline-race-envtest-helm-rbac-and-whole-product-verification",
    "three-node-arm64-kind-qualification-with-negative-controls-replay-and-clean-final-teardown"
  ],
  "requiredInventory": [
    "candidate:contrib/helm/hacknet/operator/api/v1beta1/upgradecampaign_types.go",
    "candidate:contrib/helm/hacknet/operator/internal/versionmatrix/types.go",
    "candidate:contrib/helm/hacknet/operator/internal/versionmatrix/prepare.go",
    "candidate:contrib/helm/hacknet/operator/internal/versionmatrix/assignment.go",
    "candidate:contrib/helm/hacknet/operator/internal/versionmatrix/render.go",
    "candidate:contrib/helm/hacknet/operator/internal/upgrade/plan.go",
    "candidate:contrib/helm/hacknet/operator/internal/upgrade/reconciler.go",
    "candidate:contrib/helm/hacknet/operator/internal/topology/upgrade_overlay.go",
    "candidate:contrib/helm/hacknet/operator/internal/run/v1beta1_reconciler.go",
    "candidate:contrib/helm/hacknet/operator/internal/inventory/inventory.go",
    "candidate:contrib/helm/hacknet/operator/internal/orchestratormetrics/collector.go",
    "candidate:contrib/attacknet/docs/concepts/mixed-version-images.md",
    "candidate:contrib/attacknet/docs/development/issues/r1/r1a11-mixed-version-upgrade-campaigns.md",
    "candidate:contrib/attacknet/examples/matrices/stable-with-candidate.plan.yaml",
    "candidate:contrib/attacknet/examples/matrices/raw-config-fallback.plan.yaml",
    "candidate:contrib/attacknet/examples/runs/mixed-version-boundary-upgrade.yaml",
    "candidate:contrib/attacknet/release/amendments/a11/contract.json",
    "candidate:contrib/attacknet/release/amendments/a11/verify.mjs",
    "candidate:contrib/attacknet/release/amendments/a11/evidence.mjs",
    "candidate:contrib/attacknet/release/amendments/a11/packet.mjs",
    "candidate:contrib/attacknet/release/amendments/a11/a11.test.mjs",
    "candidate:contrib/attacknet/release/amendments/a11/qualification/live.mjs",
    "candidate:contrib/attacknet/evidence-packets/release-1-a11/README.md",
    "diff:candidate-mixed-version-upgrades",
    "evidence:verification",
    "test:attacknet-check",
    "test:hacknet-check",
    "evidence:candidate-build",
    "evidence:source-drift-control",
    "evidence:configuration-control",
    "evidence:telemetry-control",
    "evidence:protocol-control",
    "evidence:static-descriptor",
    "evidence:static-import",
    "evidence:static-network",
    "evidence:upgrade-descriptor",
    "evidence:primary-network",
    "evidence:primary-run",
    "evidence:primary-upgrade",
    "evidence:replay-network",
    "evidence:replay-run",
    "evidence:replay-upgrade",
    "evidence:forensic-bundle",
    "evidence:clean-teardown",
    "evidence:live-qualification",
    "evidence:archive-index",
    "evidence:archive",
    "evidence:summary",
    "attestation:signed-candidate"
  ]
}
