{
  "schemaVersion": "stacks-attacknet-phase-review-contract/v2",
  "reviewId": "release-1-amendment-a5-api-productization",
  "phase": 2,
  "releaseScope": "Release 1 API and product-surface amendment A5",
  "tier": "Full",
  "requiredReviewers": [
    "Codex",
    "Claude Opus 5"
  ],
  "requirements": [
    "single-signed-commit-directly-on-approved-a4-with-exact-diff",
    "yaml-first-closed-v1beta1-authoring-and-deterministic-v1alpha1-conversion",
    "typed-stacksnetwork-compiles-complete-network-genesis-bootstrap-and-opaque-config-contracts",
    "burnchainpolicy-controls-resilient-bootstrap-cadence-pause-resume-and-bounded-flash",
    "faultcampaign-admits-concurrent-actions-by-aggregate-safety-and-proves-effect-recovery-cleanup",
    "attacknetrun-persists-deterministic-trigger-dag-overlap-restart-replay-and-minimization",
    "typed-go-cli-owns-host-boundaries-without-duplicating-controller-state-machines",
    "legacy-runtime-surface-is-classified-and-public-repository-boundaries-are-enforced",
    "clean-go-race-envtest-helm-whole-product-and-three-node-kind-verification",
    "accepted-scale-network-proves-thirty-ready-actors-and-eighteen-node-chain-convergence",
    "portable-self-identifying-review-evidence"
  ],
  "requiredInventory": [
    "candidate:contrib/helm/hacknet/operator/api/v1beta1/stacksnetwork_types.go",
    "candidate:contrib/helm/hacknet/operator/api/v1beta1/burnchainpolicy_types.go",
    "candidate:contrib/helm/hacknet/operator/api/v1beta1/faultcampaign_types.go",
    "candidate:contrib/helm/hacknet/operator/api/v1beta1/attacknetrun_types.go",
    "candidate:contrib/helm/hacknet/operator/internal/topology/v1beta1_compile.go",
    "candidate:contrib/helm/hacknet/operator/internal/topology/v1beta1_reconciler.go",
    "candidate:contrib/helm/hacknet/operator/internal/burnchainpolicy/reconciler.go",
    "candidate:contrib/helm/hacknet/operator/internal/fault/v1beta1_reconciler.go",
    "candidate:contrib/helm/hacknet/operator/internal/run/v1beta1_reconciler.go",
    "candidate:contrib/helm/hacknet/operator/internal/attacknetcli/app.go",
    "candidate:contrib/helm/hacknet/examples/accepted-28.yaml",
    "candidate:contrib/helm/hacknet/examples/accepted-28-burnchain-policy.yaml",
    "candidate:contrib/attacknet/repository-boundary.test.mjs",
    "candidate:contrib/attacknet/release/release-1-a5-contract.json",
    "candidate:contrib/attacknet/release/release-1-a5-evidence.mjs",
    "candidate:contrib/attacknet/release/release-1-a5-packet.mjs",
    "candidate:contrib/attacknet/release/release-1-a5-verify.mjs",
    "candidate:contrib/attacknet/release/release-1-a5.test.mjs",
    "candidate:contrib/attacknet/evidence-packets/release-1-a5/README.md",
    "diff:candidate-api-productization",
    "test:attacknet-check",
    "test:hacknet-check",
    "evidence:archive-index",
    "evidence:archive",
    "evidence:live-summary",
    "evidence:verification",
    "evidence:local-install",
    "evidence:burnchain-policy",
    "evidence:concurrent-fault",
    "evidence:run-overlap-restart",
    "evidence:replay-minimization",
    "evidence:accepted-network",
    "evidence:accepted-cohort",
    "evidence:accepted-incident",
    "evidence:clean-teardown"
  ]
}
