{
  "schemaVersion": "stacks-attacknet-phase-review-contract/v2",
  "reviewId": "release-1-amendment-a10-multi-bitcoin-split-views",
  "phase": 2,
  "releaseScope": "Release 1 multi-Bitcoin split-view amendment A10",
  "tier": "Full",
  "requiredReviewers": ["Codex", "Claude Opus 5"],
  "requirements": [
    "deterministic-admitted-bitcoin-peer-graph-policy-identities-and-stacks-follower-bindings",
    "bounded-partition-delay-and-competing-branch-campaigns-compose-with-a9-safety-controls",
    "trusted-bounded-per-bitcoin-node-and-bound-stacks-view-observations",
    "independent-baseline-divergence-and-stable-recovery-assertions-on-both-protocol-layers",
    "admitted-topology-drift-fails-closed-before-chaos-mutation",
    "same-seed-fresh-network-replay-preserves-graph-schedule-and-outcome-class",
    "bounded-cardinality-metrics-dashboard-and-complete-identity-bound-forensic-evidence",
    "clean-offline-race-envtest-helm-rbac-and-whole-product-verification",
    "three-node-arm64-kind-qualification-and-clean-final-teardown"
  ],
  "requiredInventory": [
    "candidate:contrib/helm/hacknet/operator/api/v1beta1/stacksnetwork_types.go",
    "candidate:contrib/helm/hacknet/operator/internal/burnchaintopology/topology.go",
    "candidate:contrib/helm/hacknet/operator/internal/topology/v1beta1_compile.go",
    "candidate:contrib/helm/hacknet/operator/internal/topology/v1beta1_reconciler.go",
    "candidate:contrib/helm/hacknet/operator/internal/protocolobservation/reader.go",
    "candidate:contrib/helm/hacknet/operator/internal/protocolassertion/evaluator.go",
    "candidate:contrib/helm/hacknet/operator/internal/fault/reorg_mutation.go",
    "candidate:contrib/helm/hacknet/operator/internal/orchestratormetrics/collector.go",
    "candidate:contrib/attacknet/observability/render.mjs",
    "candidate:contrib/attacknet/observability/dashboards/attacknet-overview.json",
    "candidate:contrib/attacknet/docs/concepts/bitcoin-split-views.md",
    "candidate:contrib/helm/hacknet/examples/multi-bitcoin.yaml",
    "candidate:contrib/attacknet/examples/campaigns/bitcoin-competing-branches.yaml",
    "candidate:contrib/attacknet/examples/campaigns/bitcoin-propagation-delay.yaml",
    "candidate:contrib/attacknet/examples/runs/bitcoin-split-view.yaml",
    "candidate:contrib/attacknet/release/amendments/a10/contract.json",
    "candidate:contrib/attacknet/release/amendments/a10/verify.mjs",
    "candidate:contrib/attacknet/release/amendments/a10/evidence.mjs",
    "candidate:contrib/attacknet/release/amendments/a10/packet.mjs",
    "candidate:contrib/attacknet/release/amendments/a10/a10.test.mjs",
    "candidate:contrib/attacknet/release/amendments/a10/qualification/live.mjs",
    "candidate:contrib/attacknet/evidence-packets/release-1-a10/README.md",
    "diff:candidate-multi-bitcoin-split-views",
    "evidence:verification",
    "test:attacknet-check",
    "test:hacknet-check",
    "evidence:candidate-build",
    "evidence:storage-preflight",
    "evidence:topology-drift-negative-control",
    "evidence:primary-network",
    "evidence:primary-policy-a",
    "evidence:primary-policy-b",
    "evidence:primary-run",
    "evidence:primary-campaign",
    "evidence:primary-views",
    "evidence:replay-network",
    "evidence:replay-run",
    "evidence:replay-campaign",
    "evidence:replay-views",
    "evidence:forensic-bundle",
    "evidence:clean-teardown",
    "evidence:live-qualification",
    "evidence:archive-index",
    "evidence:archive",
    "evidence:summary",
    "attestation:signed-candidate"
  ]
}
