{
  "schemaVersion": "stacks-attacknet-phase-review-contract/v2",
  "reviewId": "release-1-amendment-a2-controller-runtime-migration",
  "phase": 2,
  "releaseScope": "Release 1 controller-runtime migration amendment A2",
  "tier": "Full",
  "requiredReviewers": [
    "Codex",
    "Claude Opus 5"
  ],
  "requirements": [
    "single-commit-a1-descendant-and-complete-legacy-runtime-retirement",
    "typed-api-topology-rendering-reconciliation-and-status-equivalence",
    "fault-compilation-safety-injection-effect-recovery-and-cleanup-equivalence",
    "run-scheduling-replay-minimization-resume-and-classification-equivalence",
    "canonical-admitted-identity-and-uncached-pre-mutation-barriers",
    "crd-rbac-helm-image-and-security-contract-integrity",
    "clean-go-unit-race-envtest-and-whole-product-verification",
    "signed-candidate-live-topology-fault-pod-replacement-restart-and-teardown-proof",
    "portable-self-identifying-review-evidence-and-truthful-documentation"
  ],
  "requiredInventory": [
    "candidate:contrib/attacknet/release/controller-equivalence-v1.json",
    "candidate:contrib/attacknet/release/controller-equivalence.mjs",
    "candidate:contrib/attacknet/release/controller-equivalence.test.mjs",
    "candidate:contrib/attacknet/release/release-1-a2-contract.json",
    "candidate:contrib/attacknet/release/release-1-a2-evidence.mjs",
    "candidate:contrib/attacknet/release/release-1-a2-evidence.test.mjs",
    "candidate:contrib/attacknet/release/release-1-a2-packet.mjs",
    "candidate:contrib/attacknet/release/release-1-a2.test.mjs",
    "candidate:contrib/attacknet/release/release-1-a2-verify.mjs",
    "candidate:contrib/attacknet/release/release-1-a2-verify.test.mjs",
    "candidate:contrib/attacknet/evidence-packets/release-1-a2/README.md",
    "candidate:contrib/helm/hacknet/operator/go.mod",
    "candidate:contrib/helm/hacknet/operator/go.sum",
    "candidate:contrib/helm/hacknet/operator/Dockerfile",
    "candidate:contrib/helm/hacknet/operator/Makefile",
    "candidate:contrib/helm/hacknet/operator/tools/go.mod",
    "candidate:contrib/helm/hacknet/operator/tools/go.sum",
    "candidate:contrib/helm/hacknet/operator/api/v1alpha1/stacksnetwork_types.go",
    "candidate:contrib/helm/hacknet/operator/api/v1alpha1/faultcampaign_types.go",
    "candidate:contrib/helm/hacknet/operator/api/v1alpha1/attacknetrun_types.go",
    "candidate:contrib/helm/hacknet/operator/api/v1alpha1/schema_contract_test.go",
    "candidate:contrib/helm/hacknet/operator/internal/canonical/canonical.go",
    "candidate:contrib/helm/hacknet/operator/internal/inventory/inventory.go",
    "candidate:contrib/helm/hacknet/operator/internal/inventory/reader.go",
    "candidate:contrib/helm/hacknet/operator/internal/ownership/ownership.go",
    "candidate:contrib/helm/hacknet/operator/internal/ownership/ownership_test.go",
    "candidate:contrib/helm/hacknet/operator/internal/topology/render.go",
    "candidate:contrib/helm/hacknet/operator/internal/topology/reconciler.go",
    "candidate:contrib/helm/hacknet/operator/internal/fault/compiler.go",
    "candidate:contrib/helm/hacknet/operator/internal/fault/parameters.go",
    "candidate:contrib/helm/hacknet/operator/internal/fault/parameters_test.go",
    "candidate:contrib/helm/hacknet/operator/internal/fault/effect.go",
    "candidate:contrib/helm/hacknet/operator/internal/fault/effect_validation.go",
    "candidate:contrib/helm/hacknet/operator/internal/fault/probe.go",
    "candidate:contrib/helm/hacknet/operator/internal/fault/reconciler.go",
    "candidate:contrib/helm/hacknet/operator/internal/fault/reconciler_contract_test.go",
    "candidate:contrib/helm/hacknet/operator/internal/orchestratormetrics/collector.go",
    "candidate:contrib/helm/hacknet/operator/internal/orchestratormetrics/collector_test.go",
    "candidate:contrib/helm/hacknet/operator/internal/run/schedule.go",
    "candidate:contrib/helm/hacknet/operator/internal/run/reconciler.go",
    "candidate:contrib/helm/hacknet/operator/internal/signerset/resolver.go",
    "candidate:contrib/helm/hacknet/operator/internal/integration/envtest_test.go",
    "candidate:contrib/helm/hacknet/operator/cmd/topology-operator/main.go",
    "candidate:contrib/helm/hacknet/operator/cmd/run-operator/main.go",
    "candidate:contrib/helm/hacknet/operator/cmd/compile-check/main.go",
    "candidate:contrib/helm/hacknet/crds/testing.stacks.org_stacksnetworks.yaml",
    "candidate:contrib/helm/hacknet/crds/testing.stacks.org_faultcampaigns.yaml",
    "candidate:contrib/helm/hacknet/crds/testing.stacks.org_attacknetruns.yaml",
    "candidate:contrib/helm/hacknet/templates/rbac.yaml",
    "candidate:contrib/helm/hacknet/templates/run-rbac.yaml",
    "candidate:contrib/helm/hacknet/templates/deployment.yaml",
    "candidate:contrib/helm/hacknet/templates/run-deployment.yaml",
    "candidate:contrib/helm/hacknet/scripts/check.sh",
    "candidate:contrib/helm/hacknet/scripts/load-kind-images.sh",
    "candidate:contrib/helm/hacknet/scripts/load-kind-images.test.mjs",
    "candidate:contrib/helm/hacknet/security-contract.test.mjs",
    "candidate:contrib/attacknet/fault-compiler-equivalence.test.mjs",
    "candidate:contrib/attacknet/topology-render-equivalence.test.mjs",
    "candidate:contrib/attacknet/fault-effect-evidence.mjs",
    "candidate:contrib/attacknet/fault-effect-evidence.test.mjs",
    "candidate:contrib/attacknet/probe/probe.mjs",
    "candidate:contrib/attacknet/probe/probe.test.mjs",
    "candidate:contrib/attacknet/namespace-policy.test.mjs",
    "candidate:contrib/attacknet/lifecycle.sh",
    "candidate:contrib/attacknet/operator-pressure.mjs",
    "candidate:contrib/attacknet/operator-pressure.test.mjs",
    "candidate:contrib/attacknet/observability/render.mjs",
    "candidate:contrib/attacknet/observability/observability.test.mjs",
    "candidate:contrib/attacknet/kubernetes-runtime-contracts.mjs",
    "candidate:contrib/attacknet/kubernetes-runtime-contracts.test.mjs",
    "candidate:contrib/attacknet/topology.mjs",
    "candidate:contrib/attacknet/topology.test.mjs",
    "candidate:contrib/helm/hacknet/examples/fault-campaign.json",
    "candidate:contrib/attacknet/README.md",
    "candidate:contrib/helm/hacknet/README.md",
    "diff:candidate-controller-runtime-migration",
    "test:attacknet-check",
    "test:hacknet-check",
    "evidence:archive-index",
    "evidence:archive",
    "evidence:live-summary",
    "evidence:equivalence-report",
    "evidence:go-verify",
    "evidence:envtest",
    "evidence:helm-render",
    "evidence:topology-live",
    "evidence:reversible-fault-live",
    "evidence:pod-kill-live",
    "evidence:restart-resume-live",
    "evidence:clean-teardown"
  ]
}
